{
  "versaoManifesto": 0,
  "nome": "eduardo/convencoes-ts",
  "versao": "0.1.0",
  "descricao": "Instruções de convenção para projetos TypeScript",
  "licenca": "MIT",
  "repositorio": "https://github.com/eduardo/convencoes-ts",
  "componentes": [
    {
      "id": "convencoes",
      "tipo": "instrucao",
      "arquivo": "instrucoes/convencoes.md"
    }
  ]
}
